{
  "task_id": "python_pathspec__gitignore_match__001",
  "language": "python",
  "difficulty": "medium",
  "tags": [
    "smoke",
    "matcher",
    "gitignore",
    "path",
    "pure-python",
    "multi-module"
  ],
  "source": {
    "name": "python-pathspec",
    "url": "https://github.com/cpburnz/python-pathspec",
    "commit": "6568072c2703c72796cd02467feb924540157c92",
    "license": "MPL-2.0"
  },
  "feature": {
    "name": "gitignore-style path matching",
    "description": "Extract pathspec's core gitignore-style pattern compilation and file matching API as a standalone package.",
    "source_entrypoints": [
      "pathspec.PathSpec",
      "pathspec.gitignore.GitIgnoreSpec",
      "pathspec.util.lookup_pattern",
      "pathspec.patterns.gitignore.base.GitIgnorePatternError"
    ],
    "included_behaviors": [
      "compile gitignore pattern lines",
      "match individual file paths",
      "match iterable file collections",
      "return detailed check results with include and pattern index",
      "support directory patterns, root-anchored patterns, double-asterisk patterns, comments, escaped comments, and negation patterns",
      "walk a directory tree and match relative file paths via match_tree_files",
      "normalize absolute paths and custom path separators when matching",
      "compose PathSpec instances and support negated match_files results",
      "raise GitIgnorePatternError for invalid gitignore patterns"
    ],
    "excluded_behaviors": [
      "optional re2 backend",
      "optional hyperscan backend",
      "benchmark scripts",
      "project documentation",
      "original packaging metadata",
      "original project tests"
    ]
  },
  "entanglement": {
    "level": "medium",
    "types": [
      "resource_coupling",
      "parser_state_coupling",
      "implicit_dependency_coupling"
    ],
    "primary": "resource_coupling",
    "description": "Gitignore matching behavior is spread across pattern parsing, path normalization, and matching helpers.",
    "signals": [
      "pattern grammar and negation semantics",
      "tree/path helper interactions",
      "larger source tree than target closure"
    ]
  },
  "output": {
    "package": "featurelifted",
    "import": "from featurelifted import GitIgnoreSpec, PathSpec, GitIgnorePatternError, lookup_pattern",
    "callable": "featurelifted.PathSpec",
    "signature": "PathSpec.from_lines(pattern_factory, lines, *, backend='simple')"
  },
  "environment": {
    "python": "3.11",
    "network": false,
    "timeout_seconds": 60,
    "dependency_lock": "requirements.lock",
    "allowed_dependencies": [],
    "forbidden_dependencies": [
      "pathspec"
    ],
    "forbidden_imports": [
      "pathspec"
    ]
  },
  "tests": {
    "public": "public_tests/",
    "hidden": "hidden_tests/",
    "command": "pytest"
  },
  "scoring_reference": {
    "copy_all_bytes": 871615,
    "copy_all_loc": 12499,
    "oracle_bytes": 93441,
    "oracle_loc": 2294,
    "oracle_dependency_count": 0
  }
}
