{
  "task_id": "humanize__naturaltime_core__001",
  "language": "python",
  "difficulty": "hard",
  "tags": [
    "batch-1",
    "humanize",
    "naturaltime",
    "hard-first",
    "functional-discriminator",
    "data_model_coupling"
  ],
  "source": {
    "name": "humanize",
    "url": "https://github.com/python-humanize/humanize",
    "commit": "4.15.0-installed-snapshot",
    "license": "MIT"
  },
  "feature": {
    "name": "Humanize natural time and delta formatting",
    "description": "Extract humanize naturaltime/naturaldelta/naturaldate helpers without importing humanize.",
    "source_entrypoints": [
      "humanize.time.naturaltime",
      "humanize.time.naturaldelta",
      "humanize.time.naturaldate",
      "humanize.time.naturalday",
      "humanize.time.precisedelta"
    ],
    "included_behaviors": [
      "naturaltime relative phrasing with when=",
      "naturaldelta month/year granularity",
      "precisedelta suppress and minimum_unit",
      "naturaldate and naturalday phrasing"
    ],
    "excluded_behaviors": [
      "filesize/lists/number formatting beyond time deps",
      "non-English locale packs",
      "original humanize import at runtime"
    ]
  },
  "entanglement": {
    "level": "high",
    "types": [
      "data_model_coupling",
      "implicit_dependency_coupling"
    ],
    "primary": "data_model_coupling",
    "description": "Time humanization couples timedelta quantization, i18n gettext wrappers, and intcomma year formatting.",
    "signals": [
      "naturaltime tense derives from when= anchor",
      "precisedelta suppress/minimum_unit alter unit ladder",
      "naturaldelta months toggles year/month buckets",
      "naturaldate switches format past ~5 months"
    ]
  },
  "output": {
    "package": "featurelifted",
    "import": "import featurelifted; from featurelifted import naturaltime, naturaldelta, naturaldate, naturalday, precisedelta",
    "callable": "featurelifted.naturaltime",
    "signature": "naturaltime(value, future=False, months=True, minimum_unit='seconds', when=None) -> str"
  },
  "environment": {
    "python": "3.11",
    "network": false,
    "timeout_seconds": 60,
    "dependency_lock": "requirements.lock",
    "allowed_dependencies": [],
    "forbidden_dependencies": [
      "humanize"
    ],
    "forbidden_imports": [
      "humanize"
    ]
  },
  "tests": {
    "public": "public_tests/",
    "hidden": "hidden_tests/",
    "command": "pytest"
  }
}
