{
  "task_id": "wsproto__frame_parse_core__001",
  "language": "python",
  "difficulty": "hard",
  "tags": [
    "batch-1",
    "wsproto",
    "hard-first",
    "functional-discriminator",
    "parser_state_coupling"
  ],
  "source": {
    "name": "wsproto",
    "url": "https://github.com/python-hyper/wsproto",
    "commit": "1.3.2-installed-snapshot",
    "license": "MIT"
  },
  "feature": {
    "name": "WebSocket frame protocol",
    "description": "Extract wsproto RFC6455 frame parsing, masking, fragmentation, and control frames without HTTP handshake or connection lifecycle.",
    "source_entrypoints": [
      "wsproto.frame_protocol.FrameProtocol",
      "wsproto.frame_protocol.Opcode",
      "wsproto.frame_protocol.ParseFailed"
    ],
    "included_behaviors": [
      "parse and serialize text/binary WebSocket frames",
      "client/server masking rules and XOR payload decoding",
      "fragmented message reassembly across continuation frames",
      "ping/pong/close control frames with close codes"
    ],
    "excluded_behaviors": [
      "HTTP/1.1 upgrade handshake (h11 integration)",
      "WSConnection state machine and extensions negotiation I/O",
      "original wsproto import at runtime"
    ]
  },
  "entanglement": {
    "level": "high",
    "types": [
      "parser_state_coupling",
      "resource_coupling",
      "data_model_coupling"
    ],
    "primary": "parser_state_coupling",
    "description": "Frame protocol couples header length parsing, masking key rotation, message assembly state, and role-specific validation rules.",
    "signals": [
      "FrameDecoder buffers partial headers until length known",
      "server rejects unmasked client frames and vice versa",
      "MessageDecoder tracks continuation opcode sequences",
      "repo includes h11 sibling package for copy-all penalty"
    ]
  },
  "output": {
    "package": "featurelifted",
    "import": "from featurelifted.frame_protocol import FrameProtocol, Opcode, ParseFailed, CloseReason; from featurelifted.events import Frame",
    "callable": "featurelifted.frame_protocol.FrameProtocol",
    "signature": "FrameProtocol(client: bool, extensions: list) -> FrameProtocol"
  },
  "environment": {
    "python": "3.11",
    "network": false,
    "timeout_seconds": 60,
    "dependency_lock": "requirements.lock",
    "allowed_dependencies": [],
    "forbidden_dependencies": [
      "wsproto"
    ],
    "forbidden_imports": [
      "wsproto"
    ]
  },
  "tests": {
    "public": "public_tests/",
    "hidden": "hidden_tests/",
    "command": "pytest"
  }
}
